{
  "name": "example-plugin-3",
  "version": "2.3.0",
  "description": "Example plugin number 3.",
  "author": {
    "name": "Jeremy Longshore",
    "email": "jeremy@intentsolutions.io"
  },
  "license": "Apache-2.0",
  "homepage": "https://github.com/jeremylongshore/example-plugin-3",
  "keywords": ["a", "b", "c", "d"],
  "commands": ["/example-3"]
}
