{
  "name": "example-plugin-5",
  "version": "2.5.0",
  "description": "Example plugin number 5.",
  "author": {
    "name": "Jeremy Longshore",
    "email": "jeremy@intentsolutions.io"
  },
  "license": "Apache-2.0",
  "homepage": "https://github.com/jeremylongshore/example-plugin-5",
  "keywords": ["plugin", "kw-5"],
  "commands": ["/example-5"]
}
