{
  "name": "example-plugin",
  "version": "1.0.0",
  "description": "A valid example plugin manifest for the v2 fixture corpus.",
  "author": {
    "name": "Intent Solutions",
    "email": "dev@intentsolutions.io",
    "url": "https://intentsolutions.io"
  },
  "homepage": "https://example.com/docs",
  "license": "Apache-2.0",
  "keywords": ["example", "testing"],
  "commands": ["./commands/example.md"],
  "metadata": {
    "intent-solutions": {
      "tier": "marketplace",
      "evidence": true
    }
  }
}
