{
  "name": "example-plugin-4",
  "version": "2.4.0",
  "description": "A valid description. A valid description. A valid description. A valid description. A valid description. A valid description. A valid description. A valid description. A valid description. A valid description. A valid description. A valid description. A valid description. A valid description. A valid description. A valid description. A valid description. A valid description. A valid description. A valid description. A valid description. A valid description. A valid description. A valid description. A valid description. A valid description. A valid description. A valid description. A valid description. A valid description. A valid description. A valid description. A valid description. A valid description. A valid description. A valid description. A valid description. A valid description. A valid description. A valid description. A valid description. A valid description. A valid description. A valid description. A valid description. A valid description. A valid description. A valid description. A valid description. A valid description. A valid description. A valid description. A valid description. A valid description. A valid description. A valid description. A valid description. A valid description. A valid description. A valid description.",
  "author": {
    "name": "Jeremy Longshore",
    "email": "jeremy@intentsolutions.io"
  },
  "license": "Apache-2.0",
  "homepage": "https://github.com/jeremylongshore/example-plugin-4",
  "keywords": ["plugin", "kw-4"],
  "commands": ["/example-4"]
}
